{
  "$schema": "https://json-schema.org/draft/2020-12/schema",
  "$id": "https://github.com/viache25/azure-waste-finder/blob/main/docs/report.schema.json",
  "title": "Azure Waste Finder report",
  "description": "Output of `waste-finder --format json` (report.json). Amounts are monthly, in `currency`, list prices with 730 h per month.",
  "type": "object",
  "required": ["schema_version", "tool", "generated", "scope", "demo", "currency", "summary", "findings"],
  "additionalProperties": false,
  "properties": {
    "schema_version": {
      "description": "MAJOR.MINOR. Minor bumps add optional fields; major bumps rename or remove fields.",
      "type": "string",
      "pattern": "^1\\.[0-9]+$"
    },
    "tool": {
      "type": "object",
      "required": ["name", "version"],
      "additionalProperties": false,
      "properties": {
        "name": { "const": "azure-waste-finder" },
        "version": { "type": "string" }
      }
    },
    "generated": { "description": "Date of the run (ISO 8601).", "type": "string", "format": "date" },
    "scope": { "description": "What was scanned, e.g. `subscription 1234…` or `all subscriptions`.", "type": "string" },
    "demo": { "description": "True for `--demo` runs on built-in fake data.", "type": "boolean" },
    "currency": { "description": "ISO 4217 code of all amounts.", "type": "string", "pattern": "^[A-Z]{3}$" },
    "cost_source": { "description": "Requested cost source (`--cost-source`): `retail` = list prices, `actual` = Cost Management with retail as per-finding fallback. Each finding says which one it got. Since 1.4.", "enum": ["retail", "actual"] },
    "cost_period": {
      "description": "Days whose amortized cost Cost Management summed up (`cost_source` `actual`), else null. Since 1.4.",
      "type": ["object", "null"],
      "required": ["from", "to"],
      "additionalProperties": false,
      "properties": {
        "from": { "type": "string", "format": "date" },
        "to": { "description": "Inclusive.", "type": "string", "format": "date" }
      }
    },
    "summary": {
      "type": "object",
      "required": ["count", "monthly_savings", "yearly_savings", "unpriced", "ignored", "below_threshold", "min_monthly_savings"],
      "additionalProperties": false,
      "properties": {
        "count": { "description": "Number of reported findings.", "type": "integer", "minimum": 0 },
        "monthly_savings": { "description": "Sum of `monthly_savings` over all findings (unpriced count as 0).", "type": "number", "minimum": 0 },
        "yearly_savings": { "description": "`monthly_savings` × 12.", "type": "number", "minimum": 0 },
        "unpriced": { "description": "Findings without a price, not part of the total.", "type": "integer", "minimum": 0 },
        "ignored": { "description": "Resources skipped by the ignore tag or an exclude pattern; not in `findings`.", "type": "integer", "minimum": 0 },
        "below_threshold": { "description": "Findings saving less than `min_monthly_savings`; not in `findings`.", "type": "integer", "minimum": 0 },
        "min_monthly_savings": { "type": "number", "minimum": 0 },
        "cleanup": { "description": "Free clean-up findings (cost 0), listed in `cleanup`, not part of the total. Since 1.3.", "type": "integer", "minimum": 0 },
        "actual_costs": { "description": "Findings priced from Cost Management (`cost_source` `actual`); the others use list prices. Since 1.4.", "type": "integer", "minimum": 0 }
      }
    },
    "findings": {
      "description": "Sorted by `monthly_savings`, highest first.",
      "type": "array",
      "items": { "$ref": "#/$defs/finding" }
    },
    "trend": {
      "description": "Comparison with the report given as `--previous` (findings of the rules that ran in this run; free clean-up findings are not compared), else null. Since 1.5.",
      "type": ["object", "null"],
      "required": ["previous", "monthly_savings_change", "new", "resolved", "unchanged", "changed", "resolved_findings"],
      "additionalProperties": false,
      "properties": {
        "previous": {
          "type": "object",
          "required": ["generated", "scope", "cost_source", "monthly_savings"],
          "additionalProperties": false,
          "properties": {
            "generated": { "type": "string" },
            "scope": { "type": "string" },
            "cost_source": { "description": "`retail` for reports older than 1.4.", "type": "string" },
            "monthly_savings": { "description": "Previous total over the compared rules.", "type": "number", "minimum": 0 }
          }
        },
        "monthly_savings_change": { "description": "`summary.monthly_savings` minus `previous.monthly_savings`.", "type": "number" },
        "new": { "description": "Findings not in the previous report (`trend` `new`).", "type": "integer", "minimum": 0 },
        "resolved": { "description": "Findings of the previous report that are gone, listed in `resolved_findings`.", "type": "integer", "minimum": 0 },
        "unchanged": { "description": "Findings in both reports (`trend` `unchanged`), whatever their amount.", "type": "integer", "minimum": 0 },
        "changed": { "description": "Unchanged findings whose `monthly_savings` differ from `previous_monthly_savings`.", "type": "integer", "minimum": 0 },
        "resolved_findings": {
          "description": "Sorted by `monthly_savings`, highest first.",
          "type": "array",
          "items": {
            "type": "object",
            "required": ["rule", "resource_id", "subscription_id", "name", "resource_group", "monthly_savings"],
            "additionalProperties": false,
            "properties": {
              "rule": { "type": "string" },
              "resource_id": { "type": "string" },
              "subscription_id": { "type": "string" },
              "name": { "type": "string" },
              "resource_group": { "type": "string" },
              "monthly_savings": { "$ref": "#/$defs/amount" }
            }
          }
        }
      }
    },
    "cleanup": {
      "description": "Free clean-up findings (priced at 0, severity `info`), e.g. orphaned NICs, unattached NSGs, empty resource groups. Not part of `summary.monthly_savings` and not subject to `min_monthly_savings`. Sorted by subscription, resource group, rule, name. Since 1.3.",
      "type": "array",
      "items": { "$ref": "#/$defs/finding" }
    }
  },
  "$defs": {
    "amount": { "type": ["number", "null"], "minimum": 0 },
    "finding": {
      "type": "object",
      "required": [
        "rule", "title_de", "title_en", "severity", "resource_id", "subscription_id", "name", "resource_group",
        "location", "sku", "size_gb", "os_type", "tags", "monthly_cost", "monthly_savings", "price_note",
        "command", "docs_url"
      ],
      "additionalProperties": false,
      "properties": {
        "rule": { "description": "Rule id from the registry, e.g. `stopped_vm`.", "type": "string" },
        "title_de": { "type": "string" },
        "title_en": { "type": "string" },
        "severity": { "enum": ["high", "medium", "low", "info"] },
        "resource_id": { "type": "string" },
        "subscription_id": { "description": "Parsed from `resource_id`; empty if it has none.", "type": "string" },
        "name": { "type": "string" },
        "resource_group": { "type": "string" },
        "location": { "type": "string" },
        "sku": { "type": "string" },
        "size_gb": { "type": ["integer", "null"] },
        "os_type": { "type": ["string", "null"] },
        "age_days": { "description": "Age in days for age-based rules (e.g. days since a snapshot was created), else null. Since 1.1.", "type": ["integer", "null"], "minimum": 0 },
        "quantity": { "description": "Billed units where the price depends on them (e.g. App Service plan instances), else null. Since 1.2.", "type": ["integer", "null"], "minimum": 0 },
        "tags": { "type": "object", "additionalProperties": { "type": "string" } },
        "monthly_cost": { "description": "What the resource costs now; null if no price was found.", "$ref": "#/$defs/amount" },
        "monthly_savings": { "description": "What acting on the finding saves; equals `monthly_cost` unless the action is a downgrade.", "$ref": "#/$defs/amount" },
        "cost_source": { "description": "Where `monthly_cost` comes from: `retail` (Retail Prices API list price), `actual` (Cost Management, amortized cost of `cost_period`), null if unpriced. Since 1.4.", "enum": ["retail", "actual", null] },
        "trend": { "description": "With `--previous`: `new` (not in the previous report) or `unchanged` (same rule and resource ID); null without `--previous` and for clean-up findings. Since 1.5.", "enum": ["new", "unchanged", null] },
        "previous_monthly_savings": { "description": "`monthly_savings` in the previous report for an `unchanged` finding, else null. Since 1.5.", "$ref": "#/$defs/amount" },
        "price_note": { "description": "How the price was derived, e.g. `0.0112 €/h × 730 h`.", "type": "string" },
        "command": { "description": "The `az` command that fixes it. The tool never runs it.", "type": "string" },
        "docs_url": { "type": "string" }
      }
    }
  }
}
