{
  "schema_version": "1.3",
  "tool": {
    "name": "azure-waste-finder",
    "version": "0.1.0"
  },
  "generated": "2026-09-04",
  "scope": "demo (Contoso)",
  "demo": true,
  "currency": "EUR",
  "summary": {
    "count": 15,
    "monthly_savings": 519.0,
    "yearly_savings": 6228.0,
    "unpriced": 0,
    "ignored": 1,
    "below_threshold": 0,
    "min_monthly_savings": 0.0,
    "cleanup": 5
  },
  "findings": [
    {
      "rule": "stopped_vm",
      "title_de": "VM gestoppt, aber nicht dealloziert",
      "title_en": "VM stopped but not deallocated",
      "severity": "high",
      "resource_id": "/subscriptions/11111111-1111-1111-1111-111111111111/resourceGroups/rg-test/providers/Microsoft.Compute/virtualMachines/build-agent-02",
      "subscription_id": "11111111-1111-1111-1111-111111111111",
      "name": "build-agent-02",
      "resource_group": "rg-test",
      "location": "westeurope",
      "sku": "Standard_D4s_v5",
      "size_gb": null,
      "os_type": "Linux",
      "age_days": null,
      "quantity": null,
      "tags": {},
      "monthly_cost": 148.19,
      "monthly_savings": 148.19,
      "price_note": "0.203 €/h × 730 h",
      "command": "az vm deallocate --ids /subscriptions/11111111-1111-1111-1111-111111111111/resourceGroups/rg-test/providers/Microsoft.Compute/virtualMachines/build-agent-02",
      "docs_url": "https://learn.microsoft.com/azure/virtual-machines/states-billing"
    },
    {
      "rule": "stopped_vm",
      "title_de": "VM gestoppt, aber nicht dealloziert",
      "title_en": "VM stopped but not deallocated",
      "severity": "high",
      "resource_id": "/subscriptions/11111111-1111-1111-1111-111111111111/resourceGroups/rg-test/providers/Microsoft.Compute/virtualMachines/build-agent-01",
      "subscription_id": "11111111-1111-1111-1111-111111111111",
      "name": "build-agent-01",
      "resource_group": "rg-test",
      "location": "westeurope",
      "sku": "Standard_D4s_v5",
      "size_gb": null,
      "os_type": "Linux",
      "age_days": null,
      "quantity": null,
      "tags": {},
      "monthly_cost": 148.19,
      "monthly_savings": 148.19,
      "price_note": "0.203 €/h × 730 h",
      "command": "az vm deallocate --ids /subscriptions/11111111-1111-1111-1111-111111111111/resourceGroups/rg-test/providers/Microsoft.Compute/virtualMachines/build-agent-01",
      "docs_url": "https://learn.microsoft.com/azure/virtual-machines/states-billing"
    },
    {
      "rule": "unattached_disk",
      "title_de": "Nicht angehängte Managed Disk",
      "title_en": "Unattached managed disk",
      "severity": "medium",
      "resource_id": "/subscriptions/11111111-1111-1111-1111-111111111111/resourceGroups/rg-legacy-erp/providers/Microsoft.Compute/disks/erp-db-old-data",
      "subscription_id": "11111111-1111-1111-1111-111111111111",
      "name": "erp-db-old-data",
      "resource_group": "rg-legacy-erp",
      "location": "westeurope",
      "sku": "Premium_LRS",
      "size_gb": 512,
      "os_type": null,
      "age_days": null,
      "quantity": null,
      "tags": {
        "owner": "erp-team"
      },
      "monthly_cost": 67.58,
      "monthly_savings": 67.58,
      "price_note": "tier P20 LRS, monthly flat price",
      "command": "az disk delete --ids /subscriptions/11111111-1111-1111-1111-111111111111/resourceGroups/rg-legacy-erp/providers/Microsoft.Compute/disks/erp-db-old-data",
      "docs_url": "https://learn.microsoft.com/azure/virtual-machines/windows/find-unattached-disks"
    },
    {
      "rule": "empty_app_service_plan",
      "title_de": "Leerer App-Service-Plan",
      "title_en": "Empty App Service plan",
      "severity": "medium",
      "resource_id": "/subscriptions/11111111-1111-1111-1111-111111111111/resourceGroups/rg-intranet/providers/Microsoft.Web/serverfarms/asp-intranet-legacy",
      "subscription_id": "11111111-1111-1111-1111-111111111111",
      "name": "asp-intranet-legacy",
      "resource_group": "rg-intranet",
      "location": "westeurope",
      "sku": "S1",
      "size_gb": null,
      "os_type": "Windows",
      "age_days": null,
      "quantity": 1,
      "tags": {
        "owner": "intranet-team"
      },
      "monthly_cost": 64.24,
      "monthly_savings": 64.24,
      "price_note": "0.088 €/h × 730 h × 1 instance(s)",
      "command": "az appservice plan delete --ids /subscriptions/11111111-1111-1111-1111-111111111111/resourceGroups/rg-intranet/providers/Microsoft.Web/serverfarms/asp-intranet-legacy",
      "docs_url": "https://learn.microsoft.com/azure/app-service/overview-hosting-plans"
    },
    {
      "rule": "old_snapshot",
      "title_de": "Alter Disk-Snapshot",
      "title_en": "Old disk snapshot",
      "severity": "low",
      "resource_id": "/subscriptions/11111111-1111-1111-1111-111111111111/resourceGroups/rg-legacy-erp/providers/Microsoft.Compute/snapshots/erp-db-before-migration",
      "subscription_id": "11111111-1111-1111-1111-111111111111",
      "name": "erp-db-before-migration",
      "resource_group": "rg-legacy-erp",
      "location": "westeurope",
      "sku": "Standard_LRS",
      "size_gb": 512,
      "os_type": null,
      "age_days": 324,
      "quantity": null,
      "tags": {
        "owner": "erp-team"
      },
      "monthly_cost": 22.53,
      "monthly_savings": 22.53,
      "price_note": "0.044 €/GB-month × 512 GB (provisioned size, upper bound)",
      "command": "az snapshot delete --ids /subscriptions/11111111-1111-1111-1111-111111111111/resourceGroups/rg-legacy-erp/providers/Microsoft.Compute/snapshots/erp-db-before-migration",
      "docs_url": "https://learn.microsoft.com/azure/virtual-machines/disks-understand-billing"
    },
    {
      "rule": "old_snapshot",
      "title_de": "Alter Disk-Snapshot",
      "title_en": "Old disk snapshot",
      "severity": "low",
      "resource_id": "/subscriptions/00000000-0000-0000-0000-000000000000/resourceGroups/rg-web-old/providers/Microsoft.Compute/snapshots/web-os-before-upgrade",
      "subscription_id": "00000000-0000-0000-0000-000000000000",
      "name": "web-os-before-upgrade",
      "resource_group": "rg-web-old",
      "location": "westeurope",
      "sku": "Premium_LRS",
      "size_gb": 128,
      "os_type": null,
      "age_days": 124,
      "quantity": null,
      "tags": {},
      "monthly_cost": 16.33,
      "monthly_savings": 16.33,
      "price_note": "0.1276 €/GB-month × 128 GB (provisioned size, upper bound)",
      "command": "az snapshot delete --ids /subscriptions/00000000-0000-0000-0000-000000000000/resourceGroups/rg-web-old/providers/Microsoft.Compute/snapshots/web-os-before-upgrade",
      "docs_url": "https://learn.microsoft.com/azure/virtual-machines/disks-understand-billing"
    },
    {
      "rule": "idle_load_balancer",
      "title_de": "Load Balancer ohne Backend",
      "title_en": "Load balancer without backends",
      "severity": "low",
      "resource_id": "/subscriptions/00000000-0000-0000-0000-000000000000/resourceGroups/rg-web-old/providers/Microsoft.Network/loadBalancers/lb-web-old",
      "subscription_id": "00000000-0000-0000-0000-000000000000",
      "name": "lb-web-old",
      "resource_group": "rg-web-old",
      "location": "westeurope",
      "sku": "Standard",
      "size_gb": null,
      "os_type": null,
      "age_days": null,
      "quantity": 2,
      "tags": {},
      "monthly_cost": 16.06,
      "monthly_savings": 16.06,
      "price_note": "0.022 €/h for up to 5 rules, × 730 h (2 rules)",
      "command": "az network lb delete --ids /subscriptions/00000000-0000-0000-0000-000000000000/resourceGroups/rg-web-old/providers/Microsoft.Network/loadBalancers/lb-web-old",
      "docs_url": "https://learn.microsoft.com/azure/load-balancer/load-balancer-overview"
    },
    {
      "rule": "empty_app_service_plan",
      "title_de": "Leerer App-Service-Plan",
      "title_en": "Empty App Service plan",
      "severity": "medium",
      "resource_id": "/subscriptions/00000000-0000-0000-0000-000000000000/resourceGroups/awf-waste-demo-rg/providers/Microsoft.Web/serverfarms/awf-empty-plan",
      "subscription_id": "00000000-0000-0000-0000-000000000000",
      "name": "awf-empty-plan",
      "resource_group": "awf-waste-demo-rg",
      "location": "westeurope",
      "sku": "B1",
      "size_gb": null,
      "os_type": "Linux",
      "age_days": null,
      "quantity": 1,
      "tags": {
        "project": "azure-waste-finder"
      },
      "monthly_cost": 11.53,
      "monthly_savings": 11.53,
      "price_note": "0.0158 €/h × 730 h × 1 instance(s)",
      "command": "az appservice plan delete --ids /subscriptions/00000000-0000-0000-0000-000000000000/resourceGroups/awf-waste-demo-rg/providers/Microsoft.Web/serverfarms/awf-empty-plan",
      "docs_url": "https://learn.microsoft.com/azure/app-service/overview-hosting-plans"
    },
    {
      "rule": "stopped_vm",
      "title_de": "VM gestoppt, aber nicht dealloziert",
      "title_en": "VM stopped but not deallocated",
      "severity": "high",
      "resource_id": "/subscriptions/00000000-0000-0000-0000-000000000000/resourceGroups/awf-waste-demo-rg/providers/Microsoft.Compute/virtualMachines/awf-stopped-vm",
      "subscription_id": "00000000-0000-0000-0000-000000000000",
      "name": "awf-stopped-vm",
      "resource_group": "awf-waste-demo-rg",
      "location": "westeurope",
      "sku": "Standard_B1s",
      "size_gb": null,
      "os_type": "Linux",
      "age_days": null,
      "quantity": null,
      "tags": {
        "project": "azure-waste-finder"
      },
      "monthly_cost": 8.18,
      "monthly_savings": 8.18,
      "price_note": "0.0112 €/h × 730 h",
      "command": "az vm deallocate --ids /subscriptions/00000000-0000-0000-0000-000000000000/resourceGroups/awf-waste-demo-rg/providers/Microsoft.Compute/virtualMachines/awf-stopped-vm",
      "docs_url": "https://learn.microsoft.com/azure/virtual-machines/states-billing"
    },
    {
      "rule": "orphaned_public_ip",
      "title_de": "Ungenutzte öffentliche IP-Adresse",